{
  "id": "cyberpunk-2077",
  "name": "Cyberpunk 2077",
  "description": "Neon-soaked dark theme with signature yellow accents and futuristic edge",
  "tags": [
    "dark",
    "futuristic",
    "neon",
    "cyberpunk"
  ],
  "source": "mood",
  "tokens": {
    "color": {
      "bg": "#0a0a12",
      "bg-card": "#12121f",
      "text": "#e8e8ec",
      "text-muted": "#8a8a9e",
      "accent": "#fcee0a",
      "accent-light": "rgba(252,238,10,0.10)",
      "accent-hover": "#ffe94a",
      "border": "#2a2a3d",
      "passage-bg": "#0e0e1a",
      "passage-border": "#fcee0a33",
      "correct-color": "#00f0ff",
      "correct-bg": "rgba(0,240,255,0.08)",
      "explanation-border": "#fcee0a44",
      "cat1": "#fcee0a",
      "cat2": "#00f0ff",
      "cat3": "#ff2a6d",
      "cat4": "#05d9e8",
      "cat5": "#d300c5",
      "cat6": "#ff6b35"
    },
    "typography": {
      "heading-font": "'Orbitron',system-ui,sans-serif",
      "body-font": "'Exo 2',system-ui,sans-serif"
    },
    "shape": {
      "border-radius": "2px",
      "card-shadow": "0 0 12px rgba(252,238,10,0.08)"
    }
  },
  "effects": [
    "glow-border",
    "scanline-overlay",
    "gradient-bg"
  ],
  "google-fonts": [
    "Orbitron",
    "Exo 2"
  ],
  "overrides": ".app-container{background:linear-gradient(170deg,#0a0a12 0%,#0d0d1a 40%,#120a18 100%)}"
}
