{
  "id": "fluent-design",
  "name": "Fluent Design",
  "description": "Microsoft Fluent Design inspired — clean layers, subtle depth, signature blue",
  "tags": [
    "light",
    "corporate",
    "modern",
    "clean"
  ],
  "source": "brand",
  "tokens": {
    "color": {
      "bg": "#f5f5f5",
      "bg-card": "#ffffff",
      "text": "#1a1a1a",
      "text-muted": "#616161",
      "accent": "#0078d4",
      "accent-light": "rgba(0,120,212,0.08)",
      "accent-hover": "#106ebe",
      "border": "#e1dfdd",
      "passage-bg": "#faf9f8",
      "passage-border": "#d2d0ce",
      "correct-color": "#107c10",
      "correct-bg": "rgba(16,124,16,0.06)",
      "explanation-border": "#0078d444",
      "cat1": "#0078d4",
      "cat2": "#107c10",
      "cat3": "#d83b01",
      "cat4": "#8764b8",
      "cat5": "#008272",
      "cat6": "#c239b3"
    },
    "typography": {
      "heading-font": "'Inter','Segoe UI',system-ui,sans-serif",
      "body-font": "'Inter','Segoe UI',system-ui,sans-serif"
    },
    "shape": {
      "border-radius": "6px",
      "card-shadow": "0 2px 4px rgba(0,0,0,0.04), 0 0 2px rgba(0,0,0,0.06)"
    }
  },
  "effects": [
    "subtle-transition",
    "glass-cards"
  ],
  "google-fonts": [
    "Inter"
  ],
  "overrides": ""
}
